{
  "name": "OpenAI API",
  "category": "Natural Language Processing",
  "features": [
    "Reasoning Models (OpenAI o1, OpenAI o3-mini)",
    "GPT Models (GPT-4.5, GPT-4o, GPT-4o mini)",
    "Responses API",
    "Chat Completions API",
    "Realtime API",
    "Assistants API",
    "Batch API",
    "Web Search Tool",
    "File Search Tool",
    "Computer Use Tool",
    "Code Interpreter Tool",
    "Fine-tuning",
    "Agents SDK"
  ],
  "pricing": {
    "model": "Token-based pricing. Varies significantly by model, API, and tool usage. Separate costs for fine-tuning and storage.",
    "reasoning_models": {
      "openai_o1": {
        "input": 15.0,
        "cached_input": 7.5,
        "output": 60.0,
        "unit": "per 1M tokens"
      },
      "openai_o3_mini": {
        "input": 1.1,
        "cached_input": 0.55,
        "output": 4.4,
        "unit": "per 1M tokens"
      }
    },
    "gpt_models": {
      "gpt_4_5": {
        "input": 75.0,
        "cached_input": 37.5,
        "output": 150.0,
        "unit": "per 1M tokens"
      },
      "gpt_4o": {
        "input": 2.5,
        "cached_input": 1.25,
        "output": 10.0,
        "unit": "per 1M tokens"
      },
      "gpt_4o_mini": {
        "input": 0.15,
        "cached_input": 0.075,
        "output": 0.6,
        "unit": "per 1M tokens"
      }
    },
    "fine_tuning": {
      "gpt_4o": {
        "input": 3.75,
        "cached_input": 1.875,
        "output": 15.0,
        "training": 25.0,
        "unit": "per 1M tokens"
      },
      "gpt_4o_mini": {
        "input": 0.3,
        "cached_input": 0.15,
        "output": 1.2,
        "training": 3.0,
        "unit": "per 1M tokens"
      }
    },
    "tool_usage": {
      "code_interpreter": {
        "cost": 0.03,
        "unit": "per session"
      },
      "file_search_storage": {
        "cost": 0.1,
        "unit": "per GB of vector storage per day (first GB free)"
      },
      "file_search_tool_call": {
        "cost": 2.5,
        "unit": "per 1k tool calls (Responses API only)"
      },
      "web_search_tool_call": {
        "gpt_4o": {
          "search_context_size": {
            "low": 30.0,
            "medium": 35.0,
            "high": 50.0,
            "unit": "per 1K calls"
          }
        },
        "gpt_4o_mini": {
          "search_context_size": {
            "low": 25.0,
            "medium": 27.5,
            "high": 30.0,
            "unit": "per 1K calls"
          }
        }
      }
    },
    "notes": "Pricing is complex and varies significantly based on model, API, and tool usage. Monitor token usage carefully. See OpenAI website for detailed pricing."
  },
  "pros": [
    "Powerful and versatile models",
    "Wide range of APIs and tools",
    "Customization options (fine-tuning)",
    "Large community and extensive documentation"
  ],
  "cons": [
    "Pricing can be complex and vary significantly based on model, usage, and tools",
    "Requires careful monitoring of token usage to manage costs"
  ],
  "technical_specifications": {
    "api_type": "REST",
    "sdks": "Available (Python, etc.)"
  },
  "user_reviews": {
    "summary": "OpenAI products generally receive high ratings (e.g., Whisper has 4.5/5 on G2). G2 lists 978 reviews for OpenAI products overall. However, specific user feedback (pros/cons) for the OpenAI API could not be extracted due to scraping limitations on review sites.",
    "sources_to_check": [
      "https://www.g2.com/sellers/openai",
      "https://www.capterra.com/"
    ]
  },
  "benchmark_scores": {
    "overall_performance": "86.4% (MMLU, GPT-4)",
    "accuracy": "67.0% (HumanEval, GPT-4)",
    "speed": "Real-time",
    "task_specific": {
      "notes": "Other task-specific scores not detailed."
    }
  },
  "integration_capabilities": [
    "Widely used and integrated with various platforms and tools"
  ],
  "scalability": "Designed for scalability",
  "support_options": [
    "Documentation",
    "Community forum",
    "Enterprise support plans (paid)"
  ],
  "data_source_urls": [
    "https://openai.com/api/",
    "https://openai.com/api/pricing/"
  ],
  "last_updated": "2025-03-30",
  "description": "The OpenAI API provides access to state-of-the-art large language models (LLMs) like GPT-4o, GPT-4.5, and specialized reasoning models (o1, o3-mini). It offers various APIs (Chat Completions, Assistants, Batch, Realtime) and tools (Code Interpreter, File Search, Web Search) for building diverse AI applications. Developers can leverage these models for tasks ranging from text generation and summarization to complex reasoning and agentic workflows. Fine-tuning capabilities allow customization for specific tasks.",
  "use_cases": [
    {
      "title": "Content Generation",
      "description": "Generate creative text formats, like poems, code, scripts, musical pieces, email, letters, etc.",
      "example": "Create marketing copy or draft emails based on prompts"
    },
    {
      "title": "Conversational AI",
      "description": "Build sophisticated chatbots and virtual assistants",
      "example": "Develop a customer service bot using the Assistants API"
    },
    {
      "title": "Data Analysis & Summarization",
      "description": "Analyze data and summarize long texts or documents",
      "example": "Use Code Interpreter to analyze datasets or summarize research papers"
    },
    {
      "title": "Information Retrieval",
      "description": "Answer questions using provided context or web search",
      "example": "Build a RAG system using File Search or Web Search tools"
    }
  ],
  "training_resources": [
    {
      "type": "Documentation",
      "url": "https://platform.openai.com/docs/overview",
      "description": "Official OpenAI API documentation"
    },
    {
      "type": "Cookbook",
      "url": "https://cookbook.openai.com/",
      "description": "Examples and guides for common tasks"
    }
  ],
  "documentation_url": "https://openai.com/api/docs",
  "api_url": "https://openai.com/api/api",
  "sdk_url": "https://openai.com/api/sdk",
  "security_compliance": {
    "certifications": [
      "SOC 2 Type II",
      "ISO 27001, 27018, 27701",
      "GDPR compliant",
      "HIPAA compliant (via BAA)"
    ],
    "data_protection": "Data encrypted in transit (TLS 1.2+) and at rest (AES-256). API data submitted is not used for training by default. Zero data retention options available for eligible customers."
  }
}
